Category,Origin Category,Clean Title,Detail,PDF File
상표,['[상표]'],상표권자인 원고는 지정상품에 대한 일부포기신청을 하였으나 출원과정의 절차상 오류로 전부 포기한 것으로 처리되었고 심결은 이러한 절차상 오류가 바로잡히기 전에 심판대상물이 없다고 판단하였으므로 절차상 위법에 기초하여 이루어진 것이어서 취소되어야 한다고 본 사례,사건 개요 및 판시 요지 원고는 세계지적재산권기구 에 이 사건 국제등록출원상표 중 지정상품을 를 제외한 나머지 상품을 철회하는 일부포기신청 을 하였고 위 신청이 받아들여졌다 그런데 위 기구의 국제사무국은 위 신청의 취지와 달리 지정상품 전체가 포기된 것으로 처리하여 전산 입력하고 이를 자로 우리나라 특허청에게 통지하였고 이에 따라 이 사건 심결이 이루어졌다 그 후 원고의 신청으로 위 절차상 오류가 경정되어 위 전부포기에 관한 절차는 무효로 되어 위와 같은 지정상품에 대해서는 포기되지 않은 것으로 간주된다는 처분이 있었고 이 처분은 우리나라 특허청에게 통지되었다 피고 역시 이 사실에 관하여 다투지 않고 있다 행정처분인 특허심판원의 심결에 대한 불복의 소송인 심결취소소송은 항고소송에 해당하여 그 소송물은 심결의 실체적 절차적 위법성 여부라 할 것이므로 당사자는 심결이 판단하지 아니한 것이라도 그 심결을 위법 또는 적법하게 하는 사유를 심결취소소송절차에서 새로이 주장 증명할 수 있고 심결취소소송의 법원은 특별한 사정이 없는 한 제한 없이 이를 심리 판단하여 판결의 기초로 삼을 수 있다 대법원 선고 후 판결 등 참조 특허심판원에서는 이 사건 국제등록출원상표 중 지정상품이 모두 취소되어 심판의 대상물이 존재하지 않는다는 이유로 심판청구를 각하하는 취지로 이 사건 심결을 하였으나 그 후 위와 같은 지정상품에 대한 전부취소는 주무관청인 세계지적재산권기구의 절차상 위법 즉 출원인이 지정상품의 일부에 대해서만 포기한 것을 그 전체를 포기한 것으로 처리하여 전산입력하고 대한민국 특허청에도 그와 같은 취지로 통지한 것이 밝혀져 위 오류는 사후에 바로잡혔다 따라서 실제로는 이 사건 심결 당시 이 사건 국제등록출원상표의 지정상품은 모두 취소되지 않아 일부 지정상품이 유효하게 존속함에도 불구하고 이 사건 심결은 그 지정상품이 모두 취소되었음을 전제로 심판대상물이 없다고 판단한 것이므로 이 사건 심결은 세계지적재산권기구가 범한 위와 같은 절차상 위법에 기초하여 이루어진 것으로서 이 사건 심결에도 절차상의 위법이 존재한다고 할 것이다 그러므로 이 사건 심결에는 위와 같은 절차상 위법이 존재하므로 피고가 주장하는 바와 같은 거절사유가 존재하는지 여부에 관계없이 이 사건 심결은 취소되어야 할 것이다,상표_286
상표,['[상표]'],이 사건 등록상표의 출원인의 부정한 목적이 인정되어 이 사건 등록상표가 구 상표법 제 조 제 항 제 호에 해당한다고 본 사례,사건 개요 및 판시 요지 다음과 같은 사실이나 사정 등을 종합하면 이 사건 등록상표의 출원인은 피고의 상품을 나타내는 것이라고 인식되어 있는 선사용상표 를 모방하여 선사용상표 가 가지는 양질의 이미지나 고객흡입력에 편승하여 부당한 이득을 얻거나 선사용상표 의 가치를 희석하여 선사용상표권자에게 손해를 가할 목적으로 등록상표를 출원한 것으로 판단된다 가 앞서 본 바와 같이 선사용상표 는 등록상표의 출원일인 당시 이미 국내 및 일본에서 피고의 상품을 표시하는 것으로 인식되어진 상표에 해당하고 등록상표는 선사용상표 와 동일성이 있거나 매우 유사한 표장에 해당한다 나 출원인은 년경부터 피고와 독점 수입 판매계약을 체결하고 선사용상표들이 사용된 피고의 상품을 일본에서 국내로 수입하여 유통 판매하면서 피고의 선사용상표들의 존재를 알고 있었다 출원인은 피고 국내상표들이 존속기간 만료로 소멸하자 와 같은 상표를 출원하였고 그 이후 이 사건 등록상표를 출원하였다 다 이 사건 등록상표의 지정상품인 수동식 이발기 이발용 가위 헤어컷팅가위 가위 와 선사용상표 의 사용상품인 가위 미용가위 는 상품의 성질 및 거래실정에 비추어 서로 유사한 상품에 해당한다 라 출원인은 이 사건 등록상표의 출원 직후인 피고 측에 피고로부터 수입한 피고 상품이 아니라 출원인이 임의로 자체 제작한 미용가위 제품에 표장을 사용한 행위에 대하여 사과한 바 있고 정성훈의 배우자인 원고는 이 사건 등록상표와 그 명의로 등록한 마츠자키 상표에 기해 피고의 미용가위 제품의 한국 판매에 대해 상표권 침해 경고장 을 발송하였던 점 등에 비추어 정성훈이 이 사건 등록상표를 출원한 경위는 피고로부터 수입한 피고 상품에 이 사건 등록상표를 사용하기 위한 것이 아니라 피고의 상품을 모방한 상품에 사용하거나 피고의 국내 영업을 방해하는 등의 방법으로 피고에게 손해를 끼치려는 목적에서 이루어진 것으로 보인다,상표_287
상표,['[상표]'],이 사건 소송에서 기존에 주장하지 않은 서비스업에 기초하여 거절사유를 주장하는 것은 새로운 거절이유에 해당한다고 본 여부,사건 개요 및 판시 요지 다음과 같은 사실 또는 사정에 의하면 피고가 이 사건 심결취소소송절차에서 이 사건 출원상표가 선등록서비스표의 지정서비스업 중 제과점업 이 아니라 추가로 카페업 등 과의 관계에서 상표법 제 조 제 항 제 호에 해당한다고 주장하는 것은 의견제출의 기회를 부여한 바 없는 새로운 거절이유에 해당한다고 봄이 타당하다 자 특허청 심사관의 의견제출통지에는 이 사건 출원상표에 대해 구 상표법 제 조 제 항 제 호에 해당한다는 기재가 있으나 이 사건 출원상표의 지정상품이 선등록서비스표의 어느 지정서비스업과 유사한지 여부에 관하여 구체적으로 기재하지 않았다 자 특허청 심사관의 거절결정에서도 이 사건 출원상표의 지정상품이 선등록서비스표의 지정서비스업 중 제과점업 과 유사하여 구 상표법 제 조 제 항 제 호에 해당한다 라는 취지의 결정이 이루어졌다 이 사건 심결에서도 거절결정과 같이 이 사건 출원상표의 지정상품이 선등록서비스표의 지정서비스업 중 제과점업 과 유사하다 는 이유로 위 거절결정에 대한 불복심판이 기각되었다 위와 같은 거절결정과 이에 대한 불복심판 절차에서 이 사건 출원상표의 지정상품이 선등록서비스표의 서비스업 중 카페업 등 과 유사하다는 이유가 구체적으로 제시되거나 원고에게 그에 대한 의견 제시 혹은 필요한 조치를 취할 기회가 제공되지 않았다 원고는 이 사건 거절결정 및 이에 대한 불복심판 절차에서 특허청 심사관 등이 선등록서비스표 중 제과점업 과의 유사 여부에 대해서만 문제를 삼았기 때문에 선등록서비스표 중 제과점업 에 관해서만 불사용취소심판을 청구한 것으로 보이고 제 회 변론조서 참조 만일 특허청 심사관 등이 이 사건 출원상표가 선등록서비스표의 지정서비스업 중 카페업 등 과 유사하다는 거절이유를 통지하거나 제시하였다면 선등록서비스표의 지정서비스업 중 카페업 등 에도 불사용취소심판을 청구하였을 것으로 보인다 나 따라서 피고가 이 사건 소송절차에서 비로서 이 사건 심결의 결론을 적법하게 하는 사유로 이 사건 출원상표가 선등록서비스표의 지정서비스업 중 카페업 등 과의 관계에서 상표법 제 조 제 항 제 호에 해당한다는 점을 주장하는 것은 출원인인 원고의 절차적 권리를 해하는 것으로서 허용될 수 없고 이와 같은 사유가 이 사건 출원상표의 지정상품이 선등록서비스표의 지정서비스업 중 제과점업 과 유사하다는 이유와 주된 취지가 부합한다고 단정할 수도 없다,상표_288
상표,['[상표]'],묵시적 허락에 따른 통상사용권자의 실사용표장이 등록서비스표와 동일성 범위 내에 있어 등록서비스표의 불사용취소사유가 인정되지 않는다고 본 사례,사건 개요 및 판시 요지 불사용으로 인한 상표등록취소 제도의 취지에 비추어 볼 때 등록상표를 사용 한다고 함은 등록상표와 동일한 상표를 사용한 경우를 말하고 유사상표를 사용한 경우는 포함되지 아니하나 동일한 상표 에는 등록상표 그 자체뿐만 아니라 거래통념상 등록상표와 동일하게 볼 수 있는 형태의 상표도 포함된다고 할 것이다 한편 서비스표의 사용에는 서비스업에 관한 광고 정가표 거래서류 간판 또는 표찰에 서비스표를 표시하고 이를 전시 또는 반포하는 행위는 물론 서비스의 제공시 수요자의 이용에 공여되는 물건 또는 당해 서비스의 제공에 관한 수요자의 물건에 서비스표를 표시하는 행위 서비스의 제공시 수요자의 이용에 공여되는 물건에 서비스표를 표시한 것을 이용하여 서비스를 제공하는 행위 또는 서비스의 제공에 이용하는 물건에 서비스표를 표시한 것을 서비스의 제공을 위하여 전시하는 행위 등이 포함된다 또한 위 취소사유에 해당하려면 상표권자 전용사용권자 통상사용권자 중 어느 누구도 등록상표를 사용하지 않았어야 하고 상표법상 통상사용권은 상표권자와 사용자간의 합의만에 의하여 발생하며 통상사용권의 설정등록은 제 자에 대한 대항요건으로 되어 있을 뿐이므로 통상사용권자는 반드시 등록된 통상사용권자일 필요는 없다 또한 위와 같은 합의는 반드시 문서에 의하여 이루어져야 한다거나 어떠한 형식을 갖추어야 한다고 할 수 없고 묵시적 행위에 의하여도 할 수 있다 피고의 실사용표장 는 등록서비스표와 전체 구조가 상이하여 동일하다고 할 수 없다 그러나 실사용표장 은 등록서비스표의 요부인 오리 모양의 도형 새울목오리탕 이라는 문자 새울 목인 이라는 단 문자 모두 다소의 차이는 있으나 동일한 배치 구조로 사용하고 있어 거래 사회통념 상 등록서비스표의 동일성 범위 내에 있다 실사용표장 의 사용자는 년경 당시 등록서비스표권자의 통상사용권자로서 이후 등록서비스표권을 이전받은 원고의 묵시적 허락 하에 년 월 및 월 경에 실사용표장을 정당하게 사용하였고 따라서 등록서비스표는 이 사건 심판청구일인 전 년 이내에 국내에서 통상사용권자에 의하여 그 지정서비스업 중 하나인 오리고기 식당업에 정당하게 사용되었다,상표_289
상표,['[상표]'],여행 관련 서비스업에 을 사용할 경우 카라반을 이용한 여행 카라반에서 숙박하는 여행 등과 같이 카라반과 관련된 여행이라는 의미가 직감되므로 여행관련서비스업에 관하여 식별력이 부족하다고 한 사례,사건 개요 및 판시 요지 이 사건 국제등록출원상표 은 사전적으로 이동식 주택 승용차에 매달아 끌고 다님 말이 끄는 주거용 포장마차 특히 사막을 건너는 대상 의 의미뿐만 아니라 카라반을 짜서 여행하다 라는 의미가 있고 위 단어의 명사형인 이 동사의 의미로 사용된 경우를 말한다 영어단어 은 이동식 주택으로 여행하기라는 의미가 있다 이 사건 국제등록출원상표는 국립국어원 외래어 표기 용례에 따르면 카라반 으로 표기되는데 실제 인터넷을 통한 사용형태를 살펴보아도 은 통상 카라반 이라고 한글로 표기되고 있으며 위와 같이 표기된 한글 명칭대로 국내에서 호칭되고 있다 이 사건 심결일 이전 년의 기간 을 정하여 국내 포털사이트에서 카라반여행 이라는 단어를 검색하면 네이버 블로그에서 총 건이 다음 블로그에서 총 건이 검색되는데 이들 내용을 구체적으로 살펴보면 대표적인 사용례를 보면 두번째 카라반여행 울산 카라반 여행 동해바다가 한눈에 동해카라반펜션 가평 카라반여행 다녀왔어요 카라반여행의 최고봉은 이천 테르메덴 카라반 여행 충주 탄금호캠핑장 카라반 여행 덕산스파뷰호텔 카라반 글램핑 여행 몬스터 카라반과 함께한 강릉 카라반 여행 카라반여행 유럽카라반여행하실분 카라반 여행 같이가요 년 동안의 카라반 여행정리 카라반여행 다녀왔습니다 강원도 인제 백담계곡 카라반여행 기행 가족 일간의 유라시아 카라반 여행 올 여름엔 꼭 카라반 캠핑 여행 등이 있다 국내의 수요자들은 카라반 여행이라는 단어를 카라반을 타거나 카라반에서 숙박을 하는 여행의 일종 이라는 의미로 사용하고 있음을 알 수 있다 또한 위 기간 동안 네이버 쇼핑과 다음 쇼핑의 국내여행 카테고리를 살펴보면 국내의 판매자들은 카라반 여행 상품을 광고하면서 제주 플래티늄 카라반 원주 오크밸리 카라반 팜핑 제주 카라반 구름포해수욕장 카라반 맘빌리지카라반 과 같이 카라반 이라는 이름으로 카라반 여행 관련 상품을 판매하고 있는 사실도 알 수 있다 이러한 언어습관과 거래실정 등을 고려하면 여행 관련 서비스업에 카라반의 영어단어인 을 사용할 경우 카라반을 이용한 여행 카라반에서 숙박하는 여행 등과 같이 카라반과 관련된 여행이라는 의미가 직감되므로 이 사건 국제등록출원상표가 여행 관련 서비스업에 사용되는 경우에는 식별력이 부족하다고 할 것이다 따라서 의류 화장품 담배 식품 신발 분야에 카라반 또는 이 사용된 상표가 등록되었다는 사정 등은 이 사건 국제등록출원상표가 여행 관련 서비스업에도 식별력이 있다는 근거가 된다고 보기 어렵다,상표_290
상표,['[상표]'],등록결정시 이전에 이미 상표권이 소멸한 선등록서비스표 과의 관계에서 구 상표법 제 조 제 항 제 호에 해당한다고 판단한 이 사건 심결은 위법하다고 사례,사건 개요 및 판시 요지 구 상표법 제 조 제 항은 구 상표법 제 조 제 항 제 호에 해당하는지를 판단하는 기준시점을 상표등록출원 시 로 규정하였으나 구 상표법 제 조 제 항은 제 항 본문에도 불구하고 제 조 제 항 제 호를 이유로 하는 상표등록 취소심판의 청구인과 출원인이 같고 그 취소심판 청구일 이후에 제 조 제 항 제 호에 따른 상표등록 취소의 심결이 확정된 경우에는 그 판단 기준시점을 상표등록여부결정 시 로 규정하였다 이는 제 조 제 항 제 호에 따른 상표 등록요건의 유무를 결정함에 있어서 원칙적으로 상표등록출원 시를 기준으로 하여야 하나 그 출원 시를 기준으로 할 경우 출원인이 출원상표와 유사한 선등록상표에 대하여 불사용취소심판을 청구하여 그 상표등록을 말소시킨다고 하더라도 출원상표를 등록받을 수 없어 재출원을 하는 등 불필요한 절차를 거쳐야 하므로 이를 시정하고자 예외적으로 이러한 경우 등록상표가 선등록상표와의 관계에서 제 조 제 항 제 호에 해당하는지 여부를 등록결정 시를 기준으로 판단하도록 정한 것이다 원고는 등록서비스표를 출원하였는데 특허청 심사관은 등록서비스표가 선등록서비스표 등과 표장 및 지정서비스업이 동일 유사하므로 구 상표법 제 조 제 항 제 호에 해당하여 서비스표등록을 받을 수 없다는 내용의 의견제출통지를 하였다 원고는 특허심판원에 주식회사 진미식품을 상대로 선등록서비스표 이 서비스표권자 전용사용권자 또는 통상사용권자 중 어느 누구에 의해서도 정당한 이유 없이 그 지정서비스업에 대하여 취소심판청구일 전 계속하여 년 이상 국내에서 사용되고 있지 아니하므로 상표법 제 조 제 항 제 호에 따라 그 등록이 취소되어야 한다고 주장하면서 등록취소심판을 청구하였다 당 특허심판원은 위 심판청구를 인용하는 심결을 하여 위 심결은 확정되었다 원고는 이 사건 등록서비스표의 출원심사처리 재개요청을 하였고 등록서비스표는 등록 결정되어 같은 날 등록되었다 위와 같은 사실을 종합하면 등록서비스표의 출원인인 원고가 선등록서비스표 의 상표등록 취소심판을 청구하여 구 상표법 제 조 제 항 제 호에 따라 선등록서비스표 의 등록을 취소하는 심결이 확정되었으므로 등록서비스표가 제 조 제 항 제 호에 해당하는지 여부는 구 상표법 제 조 제 항에 따라 상표등록여부결정 시를 기준으로 하여야 한다 그런데 선등록서비스표 은 위 상표등록 취소심결이 확정되었으므로 등록서비스표의 등록여부결정 시인 에는 이미 그 상표권이 소멸하였다 따라서 등록서비스표의 지정서비스업 중 통닭전문점 간이식당업 통닭전문점 간이음식점업 에 관한 등록은 선등록서비스표 과의 관계에서 구 상표법 제 조 제 항 제 호에 해당한다고 볼 수 없고 달리 그 등록이 무효라고 할 근거가 없다 그렇다면 이와 결론을 달리하여 등록서비스표의 지정서비스업 중 통닭전문점 간이식당업 통닭전문점 간이음식점업 에 관한 등록을 무효로 본 이 사건 심결은 위법하다,상표_291
상표,['[상표]'],메뚜기쌀 이 친환경 농법으로 재배된 쌀이라는 의미로 사용되어 식별력이 미약하고 특정인에게 독점시키기에 적절하지 않으므로 요부가 될 수 없고 양 상표를 전체적 대비하면 확인대상상표는 피고 등록상표와 유사하지 않으므로 그 권리범위에 속하지 않는다고 본 사례,사건 개요 및 판시 요지 원고의 확인대상상표 이 사건 심결일 현재 원 피고뿐만 아니라 전국적으로 수십여 곳의 쌀 재배 산지에서 메뚜기쌀 을 친환경 농법에 의해 재배된 쌀이라는 의미로 사용하면서 여기에 자신의 상품을 구별하기 위하여 지명이나 그 외 식별력 강한 문언을 붙여서 사용하고 있고 이러한 사용실태에 비추어 보면 쌀 상품에 관한 한 메뚜기표 또는 메뚜기 는 식별력이 그다지 높지 않아 보이는 점 이 사건 등록상표가 등록된 이후 심결일까지 보도된 수백여 건의 신문기사에서는 메뚜기쌀 이라는 용어를 특정인의 출처표시가 아닌 친환경 농법에 의해 재배된 쌀의 의미로서 사용하고 있는 점 등을 종합하여 보면 쌀 상품에 관한 한 메뚜기 라는 용어는 공익상 특정인에게 독점을 허용하기에는 적절치 않을 뿐만 아니라 특정인의 출처표시로서 기능하기에는 그 식별력이 미약하다고 봄이 타당하다 따라서 이 사건 등록상표와 확인대상상표에 공통적으로 포함된 메뚜기 부분은 요부가 될 수 없어 양 표장을 전체로서 대비하여 본다 메뚜기쌀 산지에서 생산된 쌀 상품을 다른 산지의 쌀과 구별하기 위해 메뚜기쌀 에 고유의 지명 또는 그외 식별력 강한 부분을 병기하여 사용하고 있는 상표사용실태에 비추어 보면 확인대상상표에서도 메뚜기쌀 부분 보다는 청자골 부분이 식별력이 더 클 것이고 확인대상상표는 청자골 메뚜기쌀 청자골 메뚜기 청자골 등으로 인식되어 청자골에서 생산된 쌀 과 같은 관념을 가질 것으로 보인다 반면 이 사건 등록상표는 메뚜기표 또는 메뚜기 로 인식될 것이므로 양 상표는 호칭 외관 관념 면에서 상이하여 일반 수요자에게 쌀 상품의 출처에 관한 혼동을 야기할 염려가 없어 서로 유사하지 않다고 할 것이다 따라서 메뚜기쌀 부분이 쌀에 관하여 관용하는 상표인지 또는 품질을 보통으로 사용하는 방법으로 표시한 것인지 여부에 관해서는 더 나아가 판단할 필요 없이 원고가 확인대상상표를 쌀에 관하여 사용하는 것은 이 사건 등록상표의 권리범위에 속한다고 할 수 없다 그럼에도 이와 달리 판단한 이 사건 심결은 위법하므로 취소되어야 할 것이다,상표_292
상표,['[상표]'],고야드상표가 특정인의 상품을 표시하는 것으로 인식되어 있고 이와 유사한 출원상표에 구 상표법 제 조 제 항 제 호의 부정한 목적이 인정되어 그 등록이 거절되어야 한다고 본 사례,사건 개요 및 판시 요지 출원상표 선사용등록상표 고야드 상표 구 상표법 제 조 제 항 제 호는 국내 또는 외국의 수요자 사이에 특정인의 상품을 표시하는 것이라고 인식되어 있는 상표가 국내에 등록되어 있지 않음을 기화로 제 자가 이를 모방한 상표를 등록하여 사용함으로써 모방대상상표에 체화된 영업상 신용 등에 편승하여 부당한 이익을 얻으려 하거나 모방대상상표의 가치에 손상을 주거나 모방대상상표 권리자의 국내 영업을 방해하는 등의 방법으로 모방대상상표의 권리자에게 손해를 끼치려는 목적으로 사용하는 상표는 등록을 허용하지 않는다는 취지이다 선사용등록상표들과 동일하게 쉐브론 도형 개로 이루어진 기본도형의 반복패턴을 가지는 고야드 상표 는 프랑스 또는 국내 수요자들 사이에서 프랑스 회사인 고야드 쎙 또노레의 상표로서 상당한 정도로 알려져 있다고 봄이 타당하다 자 형태의 셰브론 도형 개가 도 각도로 합쳐져 자 모양의 기본도형을 이루고 이것이 연속 반복되는 패턴은 년부터 위 회사의 거의 모든 제품에 적용되고 있으며 이러한 기본 도형의 반복패턴은 선사용등록상표들에도 동일하게 나타나 있다 고야드 상표가 사용된 제품의 년부터 년까지의 우리나라에서의 매출 합계액은 약 백 십억 원에 이른다 고야드 상표가 사용된 상품은 다수의 언론보도를 통해 해외의 명품 브랜드 중 하나로 소개되었고 인터넷 네이버 싸이트에서 고야드 상표와 이러한 상표가 사용된 제품들을 소개하고 있는 개인 운영 블로그 수는 건 카페 수는 건에 이른다 양 표장은 기본도형의 형태면에서 동일하지는 않으나 출원상표의 기본도형은 자 형태의 쉐브론 도형 개가 서로 도의 각도를 이루도록 결합되어 이루어진 고야드 상표의 기본도형과 비슷한 형태를 가지고 있다 또한 양 표장에서 위 점들은 모두 도 부분마다 점들이 가지 색채를 갖도록 배치되어 개의 영역으로 구획된다 표기된 문자도 서로 다르기는 하나 아래로 꺽인 자 형태로 배치된 점 등의 특징이 공통된다 따라서 양 표장은 서로 유사하다 나아가 지정상품들은 모두 선사용등록상표들의 지정상품들과 동일 유사하거나 경제적 견련성을 가지고 원고가 자신의 상품이라고 제출한 가방을 보면 고야드사의 제품과 재질면에서도 비슷하고 원고가 표장면에서의 차이점이라고 주장하는 문자 부분이 표기되어 있지도 않아 고야드 상표에 체화된 영업상 신용 등에 편승하여 부당한 이익을 얻으려 하는 등의 부정한 목적이 인정된다,상표_293
