Category,Origin Category,Clean Title,Detail,PDF File
상표,['[상표]'],사건,판시사항 선등록서비스표들의 관찰 방법 표장의 유사 여부 소극 오인 혼동의 염려 소극 판결요지 심결취소 이 사건 출원상표 선등록서비스표 선등록서비스표 선등록서비스표들의 관찰 방법 선등록서비스표 선등록서비스표 은 일반 수요자나 거래자에게 그 일부인 과 으로 각 호칭되거나 인식되기보다는 그 전체로서 호칭되거나 인식된다고 판단된다 표장의 유사 여부 소극 가 전체적으로 이 사건 출원상표와 선등록서비스표 를 관찰하면 이 사건 출원상표는 고딕체인 영문자 개로 구성되어 있다 선등록서비스표 은 오른쪽으로 기울어진 부드러운 곡선 형태의 영어 알파벳 개로 구성되어 있고 선등록서비스표 는 한글표장만으로 구성되어 있어 이 사건 출원상표와 그 외관에 차이가 있다 나 이 사건 출원상표는 뱅 으로 호칭된다 앞서 본 바와 같이 선등록서비스표 는 그 전체로서 뱅뱅 으로 호칭되고 숨이 거세게 나오는 파열음 이 반복되는 것으로 전체적으로 이 사건 출원상표와 상이하게 청감된다 다 이 사건 출원상표는 쾅하고 치다 쾅하고 닫다 쾅 소리가 나게 놓다 의 의미를 갖는 영어 단어이다 반면 선등록서비스표 은 요란스러운 총격전 스포츠 플레이 등이 연달은 의 의미를 갖는 영어 단어 이 띄어쓰기 없이 결합된 것이고 선등록서비스표 는 일정한 좁은 범위를 자꾸 도는 모양 등의 의미를 갖는 단어이다 또한 앞서 본 바와 같이 선등록서비스표 는 그 전체로서 인식될 뿐 그 일부인 또는 으로 인식되지 않는다 따라서 이 사건 출원상표와 선등록서비스표 는 관념에 있어서도 차이가 있다 오인 혼동의 염려 소극 이 사건 출원상표와 선등록서비스표 는 외관 호칭 관념에서 차이가 있는 점 이 사건 출원상표는 그 지정상품인 골프채 등과 관련하여 일반 수요자나 거래자들에게 어느 정도 알려진 것으로 보이는 점 선등록서비스표권자인 은 이 사건 출원상표와 동일하거나 유사한 표장을 이 사건 출원상표와 동일 유사한 지정상품 또는 서비스업에 관하여 상표 또는 서비스표로 등록을 받았으나 불사용을 이유로 그 등록이 취소된 점을 종합하여 보면 이 사건 출원상표가 선등록서비스표 와 동일 유사한 지정상품에 사용된다고 하여도 일반 수요자나 거래자로 하여금 그 출처에 관하여 오인 혼동을 일으키게 할 염려가 없다고 봄이 타당하다 따라서 이 사건 출원상표는 선등록서비스표 와 그 표장이 전체적으로 유사하지 않으므로 지정상품과 지정서비스업 사이의 동일 유사 여부에 관하여 더 나아가 살펴볼 필요 없이 상표법 제 조 제 항 제 호에 해당한다고 볼 수 없다,상표_1
상표,['[상표]'],사건,판시사항 절차적 위법 주장에 관한 판단 소극 구 상표법 제 조 제 항 제 호 해당 여부 소극 구 상표법 제 조 제 항 제 호 해당 여부 소극 구 상표법 제 조 제 항 제 호 전단 해당 여부 소극 판결요지 청구기각 상표법 제 조 제 항의 의미 상표법 제 조 제 항은 심판에서 당사자 등의 신청에 의하여 또는 직권으로 증거조사나 증거보전을 할 수 있다고 규정하고 있고 같은 법 제 조 제 항은 심판장은 위 제 항에 따라 직권으로 증거조사나 증거보전을 하였을 경우에는 그 결과를 당사자 등에게 송달하고 기간을 정하여 의견서를 제출할 수 있는 기회를 주어야 한다고 규정하고 있다 이와 같은 상표법 제 조 제 항은 심판의 적정을 기하여 심판제도의 신용을 유지하기 위하여 준수하지 않으면 안 된다는 공익상의 요구에 기인하는 이른바 강행규정이라 할 것이다 대법원 선고 후 등 판결 등 참조 따라서 특허심판원이 직권으로 조사한 증거에 대하여 당사자 또는 참가인에게 의견진술의 기회를 주지 않은 채 이루어진 심결은 원칙적으로 위법하여 유지될 수 없고 이러한 의견서 제출의 기회가 주어지지 아니한 채 직권으로 이루어진 증거조사나 증거보전은 형식상으로는 이러한 의견서 제출의 기회가 주어지지 아니하였어도 실질적으로는 이러한 기회가 주어졌다고 볼 수 있을 만한 특별한 사정이 없는 한 위법한 것으로서 허용되지 않는다 특허법원 선고 허 판결 등 참조 절차적 위법 주장에 관한 판단 소극 원고는 이 사건 심결의 각주에 기재된 근거는 특허심판원이 직권으로 증거 조사한 결과임에도 원고에게 의견을 제출할 기회를 주지 않았으므로 상표법 제 조 제 항을 위반한 절차적 위법이 있다고 주장한다 그러나 이 사건 심결의 각주는 본문을 설득력 있게 뒷받침하기 위해 인터넷 포털 사이트의 검색 결과를 부기하였던 것으로 보이는 점 원고와 피고는 이 사건 심판절차 및 이어진 서면 의견서 제출을 통해 각주와 관련된 주장을 충분히 하였고 주장을 뒷받침할 자료를 제출하였으며 서로 상대방의 주장에 대해 의견서를 제출할 기회를 제공받은 것으로 보이는 점 등을 종합하여 보면 특허심판원이 각주에서 예시로 든 위 인터넷 검색 자료에 대하여도 실질적으로 원고에게 의견서 제출의 기회가 제공되었다고 봄이 타당하다 따라서 원고의 주장은 이유 없다 구 상표법 제 조 제 항 제 호 해당 여부 소극 우리나라 일반 소비자들의 영어 교육수준에 비추어 보면 와 을 합하더라도 바다나 만과 관련된 모임 동호회 또는 이러한 모임을 하는 장소 를 암시할 수는 있으나 이를 넘어 만 에 위치한 호텔 등 숙박시설 이라는 의미가 직감된다고 단정하기는 어려운 점 이 사건 등록서비스표의 등록결정일 당시 그 지정서비스업에 관하여 일반 수요자나 거래자들에게 이 바닷가의 숙박시설로 인식된다고 볼만한 자료도 없다는 점 등을 종합하여 보면 이 사건 등록서비스표는 구 상표법 제 조 제 항 제 호에 해당하지 않는다 구 상표법 제 조 제 항 제 호 해당 여부 소극 이 사건 등록서비스표는 영어 단어 와 이 띄어쓰기 없이 동일한 서체와 크기로 구성된 영문 표장인 점 이 사건 등록서비스표는 우리나라 일반 수요자나 거래 당사자들의 일반적인 영어 수준에 비추어 볼 때 의미 파악이 쉽고 발음이 어렵지 않은 영어 단어들로 구성되어 있고 각 단어의 음절도 길지 않아 으로 한눈에 인식될 수 있는 점 등을 종합하여 보면 이 사건 등록서비스표는 구 상표법 제 조 제 항 제 호에 해당한다고 보기 어렵다 구 상표법 제 조 제 항 제 호 전단 해당 여부 소극 을 구성하는 각 영단어의 사전적 의미 사용 형태 숙박업 등 지정서비스업과의 관계 거래사회의 실정 등을 모두 고려해 보면 이 사건 등록서비스표는 그 지정서비스업에 관하여 구체적인 성질을 직감시킨다고 볼 수 없고 그 지정서비스업에 관하여 을 사용하더라도 일반 수요자가 이를 만 내지 해변에 위치한 호텔 등 숙박시설 로 인식한다고 보기 어렵다 따라서 이 사건 등록서비스표는 구 상표법 제 조 제 항 제 호 전단의 등록무효 사유에 해당하지 않는다,상표_2
상표,['[상표]'],티원 권리범위확인 사건,판시사항 확인대상표장과 실사용 표장의 동일성 여부 적극 확인대상표장이 상표적으로 사용되었는지 여부 적극 이 사건 등록상표와 확인대상표장의 유사 여부 적극 판결요지 심결취소 이 사건 등록상표 피고의 확인대상표장 실사용 표장 티원 확인대상표장과 실사용 표장의 동일성 여부 적극 확인대상표장과 실사용 표장의 차이나는 부분은 사용상품인 화장품 콜라겐 마스크의 성질을 표시하는 것으로 식별력이 없고 확인대상표장과 결합하여 새로운 관념이나 식별력을 형성한다고 보기 어려우므로 부기적인 부분에 해당한다고 봄이 타당하다 따라서 확인대상표장은 실사용 표장과 동일성의 범위 내에 있다 확인대상표장이 상표적으로 사용되었는지 여부 적극 확인대상표장의 사용상품인 화장품 스킨케어용 화장품 콜라겐 마스크의 일반 수요자나 거래계에서 콜라겐 을 티원콜라겐 으로 약칭하여 표기하고 있었다고 보기 어려우므로 확인대상표장이 여러 종류의 콜라겐 중 을 의미하는 것으로 직감된다고 볼 수 없다 피고는 간단하고 흔한 표장인 의 한글 음역에 해당하는 확인대상표장이 식별력 없다는 취지로 주장한다 그러나 이 간단하고 흔한 표장에 해당한다고 하더라도 티원 이 간단하고 흔한 표장이라고 볼 수 없고 티원 으로부터 이 직감된다고 보기도 어려우므로 피고의 주장은 이유 없다 확인대상표장이 표시된 위치 및 크기에 비추어 보면 피고가 확인대상표장을 자타상품의 출처표시를 위하여 사용하고 있다고 봄이 타당하다 이 사건 등록상표와 확인대상표장의 유사 여부 적극 이 사건 등록상표 은 띄어쓰기 없이 같은 크기 같은 서체로 구성되어 있다 콜라겐 은 화장품의 성분으로 사용되고 은 어떤 성분의 함유량이 임을 의미할 수 있으므로 이 사건 등록상표 중 콜라겐 부분은 그 지정상품의 원재료 품질을 연상시키는 것으로 식별력이 없거나 미약하다 반면 티원 은 조어이고 간단하고 흔히 있는 표장이라 볼 수 없으므로 지정상품과의 관계에서 식별력이 인정된다 따라서 이 사건 등록상표 중 티원 부분이 요부에 해당한다고 봄이 타당하다 확인대상표장은 이 사건 등록상표의 요부인 티원 과 외관 호칭이 동일하므로 이 사건 등록상표의 권리범위에 속한다,상표_3
상표,['[상표]'],라마다 거절결정 사건,판시사항 선사용상표의 사용상품인 호텔업 리조트업 등 이 이 사건 출원상표의 지정상품인 골프장예약업 과 경제적 견련성이 있어서 이 사건 출원상표의 표장 을 지정상품에 사용할 경우 상품 출처에 관하여 오인 혼동을 초래하여 수요자를 기만할 염려가 있는지 여부 적극 판결요지 청구기각 이 사건 출원상표 선사용상표 라마다 상품류 구분 제 류의 골프장예약업 호텔업 리조트업 등 이 사건 출원상표의 지정상품은 골프장예약업 으로 선사용상표의 사용상품인 호텔업 리조트업 등과 대비할 때 그와 동일 유사한 상품으로 보기는 어렵다 그러나 라마다 는 기준으로 세계에서 가장 많은 객실을 보유한 호텔 기업 중 위인 의 계열 회사인 선사용상표권자가 운영 중인 호텔 브랜드로 국내에도 여 개의 라마다 직영 호텔들이 운영되고 있다 그리고 선사용상표권자는 년경 강원도 평창에 소재한 라마다호텔 스위트 에서 골프 멤버십 서비스를 제공하고 있고 명문 골프장 주중 주말 골든 타임 부킹 보장 이라는 광고문구를 사용하여 골프장 예약 서비스를 홍보하고 있다 이에 비추어 보면 선사용상표권자는 특정인의 상표로 인식될 수 있는 정도로 알려져 있는 선사용상표를 이용하여 일반 수요자나 거래자에게 단순히 호텔 리조트 등과 관련한 서비스만을 제공하는 데 그치지 아니하고 골프장 이용이나 예약과 관련한 서비스도 함께 제공하고 있는 것으로 보인다 최근 골프의 대중화에 따라 다수의 호텔과 리조트들은 부대시설로서 골프장을 함께 운영하고 있고 여행사에서는 골프장 이용권과 호텔 숙박권을 하나로 묶은 골프 패키지 관광 상품을 판매하고 있는 것으로 확인된다 또한 국어사전에도 골프장 시설을 갖춘 호텔 의 의미인 골프텔 이 등재되어 있고 인터넷 포털 사이트인 에서 골프텔 을 검색하면 다수의 골프텔 후기 게시글과 골프텔 관광 상품 판매글을 확인할 수 있다 이러한 점 등을 고려해 보면 이 사건 출원상표의 지정상품인 골프장예약업 의 주된 소비자층은 선사용상표의 사용상품인 호텔업 리조트업 등의 소비자층과 상당 부분 중복된다고 봄이 타당하다 출원인인 원고는 직접 라마다골프앤드호텔 을 운영하면서 골프장예약업 뿐만 아니라 호텔 관련한 서비스도 함께 제공하고 있어 이 사건 출원상표가 그 지정상품에 관하여 사용되는 경우 일반 수요자나 거래자로 하여금 선사용상표권자와 일정한 인적 또는 자본적인 관계에 있는 자에 의하여 골프장예약업 관련한 서비스가 제공되는 것으로 오인하게 할 여지가 충분하다 따라서 이 사건 심결일인 당시 골프장예약업 과 호텔업 리조트업 등은 경제적인 견련의 정도가 매우 밀접하므로 이 사건 출원상표가 골프장예약업 에 사용된다면 그것이 선사용상표권자에 의하여 사용되는 것이라고 오인될 소지가 충분하여 상품 출처에 관하여 오인 혼동을 일으켜 수요자를 기만할 염려가 있다고 판단된다,상표_4
상표,['[상표]'],곰배령 등록무효 사건,판시사항 지방자치단체로서 음심점업에 관한 사업자등록을 받고 카페를 운영하는 피고 인제군 가 행정구역 내 지명을 표장으로 한 쟁점상표의 소멸에 직접적인 이해관계를 가진다고 판단한 사례 쟁점상표는 등록결정일인 또는 심결일인 기준으로 구 상표법 제 조 제 항 제 호에서 정한 현저한 지리적 명칭만으로 구성된 상표 에 해당한다고 볼 수 없다고 판단한 사례 판결요지 심결취소 이해관계인 해당 여부에 관한 판단 피고는 쟁점상표의 소멸에 직접적인 이해관계를 가진다고 할 것이다 이유는 다음과 같다 가 피고는 사업의 종류를 업태 부동산업 음식점업 으로 하는 사업자등록을 받았다 나 피고는 심결 당시 인제군 다문화 카페 를 운영하고 있다 다 피고는 지방자치단체이고 곰배령 은 피고의 행정구역 내 산인 점봉산 정상에서 남쪽으로 내려가는 능선에 위치한 장소의 이름이다 구 상표법 제 조 제 항 제 호 해당 여부에 관한 판단 가 곰배령이 등록결정일 기준으로 지정상품의 일반 수요자로 볼 수 있는 전국의 국민에게 실재하는 지리적 명칭으로 직감될 정도로 널리 알려졌다고 인정하기에 부족하다 이유는 다음과 같다 곰배령이 속한 점봉산 일대는 오지에 위치해 있고 년부터 일반인의 출입이 제한되었다가 경에야 제한적으로 개방되었다 대관령 추풍령 한계령 등과는 달리 곰배령은 국립국어원 표준국어대사전에 지명으로 등재되어 있지 않다 곰배령을 소재 내지 배경으로 한 프로그램이 방영되거나 기사 등이 보도되었다는 사실만으로 곰배령의 전국적인 지명도가 높아졌다고 단정하기는 어렵다 곰배령을 주제로 한 수필 등 문학작품 등은 당시 출간된 책의 판매 부수나 화제성 등을 파악할 수 있는 자료가 없다 피고가 실시한 인제군 사회조사 는 조사 대상이 인제군에 거주하는 주민으로 한정되어 있으므로 일반 수요자의 인식의 정도를 가늠할 수도 없다 나 곰배령이 심결일 당시까지도 전국의 국민에게 실재하는 지리적 명칭으로 직감될 정도로 널리 알려졌다고 인정하기에 부족하다 이유는 다음과 같다 강원도 보도자료는 양양국제공항 이용객 유치에 관한 것으로 구체적인 사업의 내용이나 규모 등을 파악할 수 있는 기재가 없다 인제군지는 집필진이 주로 인제군 지역에서 활동하는 사람들로 이루어져 있어 국내 일반 수요자들의 인식을 나타내는 것으로는 보기 어렵다 의 곰배령 은 일부 팬들에 의하여 반복적으로 시청되었을 개연성이 존재하고 시청자들이 전국 국민의 대표성 있는 표본에 해당한다고 단정하기 어렵다 산림청이 곰배령을 관리 또는 연구한다는 사정으로부터 곧바로 곰배령이 전국 국민에게 널리 알려진 지리적 명칭에 해당한다고 인정하기는 어렵다 피고가 실시한 인제군 사회조사 는 응답자의 거주지가 모두 인제군이므로 해당 조사의 결과에 기초하여 전국 국민의 인식을 추정할 수 없다 곰배령 방문 예약자나 방문객의 수는 전국 국민의 상당수가 곰배령을 실재하는 지리적 명칭으로 알고 있다고 볼 정도의 충분한 수치라고 판단되지 않는다 검색엔진의 특성상 과거의 자료가 삭제되지 않고 누적될 개연성이 존재할 뿐만 아니라 피고가 들고 있는 검색 결과만으로는 일반 수요자가 곰배령을 잘 알게 되었다고 보기 어렵다 결론 등록상표는 등록결정일인 또는 심결일인 기준으로 구 상표법 제 조 제 항 제 호에서 정한 현저한 지리적 명칭만으로 구성된 상표 에 해당한다고 볼 수 없다 이와 결론을 달리 한 이 사건 심결은 위법하다,상표_5
상표,['[상표]'],그린박스 거절결정 사건,판시사항 이 사건 출원상표가 지정상품과의 관계에서 기술적 표장에 해당하는지 여부 적극 이 사건 출원상표가 사용에 의한 식별력을 취득하였는지 여부 소극 판결요지 청구기각 상표법 제 조 제 항 제 호 해당 여부 적극 다음과 같은 이유로 이 사건 출원상표인 는 그 지정상품에 사용될 경우 일반 수요자나 거래자에게 녹색의 식품보관용기 또는 환경 친화적인 식품보관용기 등의 의미로 인식되어 상품의 형상 색상 품질 효능 등을 강하게 연상시키거나 직감하게 할 것이므로 지정상품과의 관계에서 상표법 제 조 제 항 제 호에서 정한 기술적 표장에 해당한다고 봄이 타당하다 가 이 사건 출원상표의 표장인 는 사전적 의미가 없는 조어에 해당하나 영문자 은 녹색의 등의 의미를 가지고 있고 영문자 는 용기로서의 상자 함 상자에 넣다 등의 의미를 가진 영문자 의 복수형 단어이므로 는 일차적으로 녹색의 용기들 의 의미로 사람들에게 쉽게 인식될 것으로 보이고 이는 지정상품인 식품보관용기 등의 형상과 색상을 직감하게 한다 나 이 사건 출원상표의 표장인 에서 영문자 은 친환경의 환경 친화적인 등의 의미도 있는데 은 국내에서도 환경 친화적인 녹색환경 생태계 보호 등의 의미로 흔히 사용되고 있음을 알 수 있으므로 일반 수요자나 거래자는 를 환경 친화적인 용기들 등의 의미로도 쉽게 인식할 수 있다고 보이고 이는 지정상품인 식품보관용기 등의 효능 등을 직감하게 한다 다 원고 제품은 대부분 녹색 용기의 형상을 갖추고 있는 것으로 보이고 원고도 원고 제품을 친환경 보관용기 음식물 쓰레기를 줄여주어 생활비 절감은 물론 지구환경을 보호하는 착한 제품 등으로 홍보하였다 그런데 이 사건 출원상표의 지정상품에 대한 거래계에서 녹색의 환경 친화적인 등의 의미를 가진 이라는 표장은 지정상품의 형상 색상 또는 품질 효능 등을 표시하는 표장으로서 누구나 그 사용을 원할 수 있고 라는 표장은 용기 상자 라는 의미로서 지정상품의 보통명칭에 해당하므로 이들이 결합된 라는 표장을 특정인에게 독점배타적으로 사용하게 하는 것이 공익상 적당하다고 보기 어렵다 라 원고는 이 사건 출원상표의 지정상품과 동일 유사한 상품에 관하여 표장을 로 하여 이미 상표등록을 받기도 하였다 상표법 제 조 제 항 해당 여부 소극 원고 승계참가인이 제출한 증거들만으로는 사용에 의하여 식별력을 취득하였다고 주장하는 실사용 표장 데비마이어 그린백 그린박스 데비마이어 데비마이어 그린박스 의 구성 중에서 부분만으로 그 사용상품과의 관계에서 자타상품의 출처표시로서 일반 수요자나 거래자에게 분리되어 인식될 것이라거나 이 사건 출원상표가 그 사용상품에 관하여 자타상품의 식별력을 취득하였다고 보기 어렵다 따라서 이 사건 출원상표는 상표법 제 조 제 항에 해당하지 않는다,상표_6
상표,['[상표]'],조선협객전 사건,판시사항 선사용상표 게임서비스가 중단과 재개를 반복하다가 결국 중단된 상태에서 원고가 선사용상표와 동일 유사한 상표를 컴퓨터 게임프로그램 등에 관하여 등록받은 사안에서 일반 수요자들은 여전히 선사용상표의 출처를 실질상 동일하고 일관된 것으로 인식하고 있었다는 이유로 원고의 이 사건 등록상표가 상표법 제 조 제 항 제 호 수요자를 기만할 염려가 있는 상표 로서 무효로 되어야 한다고 판단한 사례 판결요지 청구기각 등록상표가 상표법 제 조 제 항 제 호 수요자를 기만할 염려가 있는 상표 에 해당하려면 대비되는 선사용상표나 사용상품이 저명하여야 할 필요까지는 없고 국내 수요자나 거래자에게 그 상표나 상품이라 하면 곧 특정인의 상표나 상품이라고 인식될 수 있을 정도로 알려져 있으면 되며 이때 선사용상표 권리자의 명칭이 구체적으로 알려져야 하는 것은 아니고 누구인지 알 수 없다 하더라도 동일하고 일관된 출처로 인식될 수 있으면 충분하다 이 사건 등록상표는 상표법 제 조 제 항 제 호 수요자를 기만할 염려가 있는 상표 에 해당한다 선사용상표는 이 사건 등록상표 등록결정일 무렵과 이 사건 심결 당시 일반 수요자나 거래자에게 특정인의 상표로 인식될 수 있을 정도로 알려져 있었다 선사용상표 게임은 이 임진왜란을 배경으로 제작한 게임으로 년경 출시되고 년가량은 국내 게임업계와 게임이용자들 사이에 같은 해 출시되어 지금까지 서비스되고 있는 주식회사 의 리니지 와 어깨를 나란히 한다는 말이 있었을 정도로 대표적인 온라인 게임이었다 선사용상표 게임은 운영주체가 여러 차례 바뀌고 서비스 중단과 재개를 반복하였으나 이후에 선사용상표 게임서비스를 제공한 업체들은 양수 계약 저작권 등록 등급분류 등을 통하여 불완전하게나마 직전 운영주체로부터 권리를 승계하는 형식을 취하였다 마지막 운영주체인 피고가 년경부터 여러 사람에게서 선사용상표 게임에 관한 권리 양도 라이선스 부여 등을 문의 및 제안받은 점과 관련 기사 등에 비추어 보면 게임이용자들이나 업계도 선사용상표 게임이 순차로 이어진 것으로 인식하였다 계약의 형식과 절차 유효성 등을 떠나 측은 선사용상표 게임서비스 운영권 등을 에 이전할 진정한 의사가 있었다고 인정된다 결국 일반 소유자들은 이 사건 등록상표의 등록결정일이나 이 사건 심결 당시 조선협객전 이라고 했을 때 에서 피고까지 이어지는 출처를 실질상 동일하고 일관된 것으로 인식하고 있었다고 봄이 타당하다 게임서비스 운영상 불안정성이 곧바로 상표 출처의 비일관성을 의미한다고 볼 수 없고 양도계약서의 효력이나 피고의 운영 상태 등이 수요자 인식에 직접 영향을 주는 것도 아니다 선사용상표와 이 사건 등록상표는 유사하다 두 상표는 조선협객전 이라는 문자 부분을 공통으로 포함하고 있어 표장이 유사하다 선사용상표는 온라인 게임서비스업에 사용되었고 이 사건 등록상표의 지정상품은 온라인게임프로그램 등이어서 두 상표가 사용되는 상품도 유사하다 국내 일반 수요자나 거래자들은 이 사건 등록상표가 사용된 컴퓨터 게임프로그램을 접하면 그것이 피고가 재개한 서비스이거나 적어도 피고의 권리를 양수한 주체가 공급한 상품이라고 오인 혼동할 가능성이 크다 예컨대 선사용상표 게임서비스 운영이 중단됨에 따라 게임머니나 게임아이템 구입 거래와 관련하여 피해를 입었던 이용자들이 피고가 아니라 원고에게 보상을 요구할 수도 있다,상표_7
