Category,Origin Category,Clean Title,Detail,PDF File
가사,['[가사]'],남편의 이혼 및 위자료 청구 등을 받아들이고 아내가 제기한 같은 내용의 반소를 모두 기각한 사안,과 은 약 년 전 혼인신고를 마친 법률상 부부 은 혼인 기간 동안 다음과 같은 행위를 하였음 시부모에게 지속적으로 거짓말을 하거나 온라인 카페에서 공동구매를 진행하면서 구매자들로부터 돈을 받고 물건을 보내주지 않아 사기죄로 벌금형을 받음 회사 영업직으로 일하면서 남편과 시아버지의 서명 및 관련 계약서를 위조하고 남편 명의로 휴대전화를 개통한 후 각종 결제를 하여 그들 명의로 다액의 채무를 발생시킴 시아버지가 그 사실을 인지하고 돈이 자꾸 빠져나간다고 이야기하자 다른 직원의 실수로 그렇게 되었는데 자신이 해결하겠으니 통장에 있는 돈을 모두 인출하라 는 취지로 이야기한 후 출금해놓은 수천만 원의 돈을 훔쳐감 시아버지의 신용카드 사진을 몰래 찍어 물품대금 결제에 무단으로 사용하고 결국에는 카드를 훔쳐 사용하거나 현금서비스를 받음 사채를 쓰면서 사채업자와 성관계를 갖고 그 장소에 자신의 아들을 데려가기도 함 시어머니에게 사채업자로부터 성관계 동영상 유포 협박을 받고 있다고 말하여 시어머니가 이를 해결해주기도 함 남편이 말다툼 후 아이들을 데리고 나가려 하자 부엌에서 칼을 들고 와 자신의 배를 찌르고 이를 막으려는 남편에게 상해를 가함 은 이 칼로 자신의 배를 찌른 직후 별거하였고 이 을 고소하여 절도 사문서위조 등 혐의로 형사재판이 진행 중임 은 이혼 위자료 등을 청구하는 소를 제기하였고 도 비슷한 내용의 반소를 제기함 이에 대하여 다음과 같이 판단한 사례 서로 이혼을 청구하고 별거 중이며 에 대한 범죄행위로 형사재판이 진행 중인 점을 고려하면 혼인관계 파탄이 인정됨 부부 사이에 있어서는 안 될 행동을 함으로써 신뢰와 애정을 심각하게 손상시킨 에게 혼인관계 파탄의 주된 책임이 있음 의 유책사유로 혼인관계가 파탄되었고 이 정신적 손해를 입었음이 명백하므로 은 에게 위자료를 지급할 의무가 있고 제반 사정을 고려하여 위자료 액수는 만원으로 결정함 자녀들의 양육자는 으로 정하고 은 양육비로 자녀들이 성년이 되기 전날까지 인당 월 만원을 매월 말일 지급할 의무가 있음,No_PDF
가사,['[가사]'],재산분할에 관한 명시적 일부 청구 이후 잔부 청구가 가능하고 다만 기존 판결의 재산분할 비율을 다툴 수는 없다고 판단한 사안,법률상 부부였던 과 은 판결을 통해 이혼하였는데 당시 은 명시적으로 재산분할 중 일부 금액만을 특정하여 청구하였음 은 다시 을 상대로 나머지 재산분할을 청구하는 소를 제기하면서 기존 판결에서 산정된 기여도가 부당하다는 주장 등을 함 다음과 같은 이유로 잔부 청구가 가능하다고 판단한 사례 부부 일방이 재산분할 정산금의 지급을 구할 수 있게 되면 이는 금전채권으로서 가분채권에 해당함 재산분할은 비송사건으로서 직권탐지주의 가사소송법 제 조 비송사건절차법 제 조 가 적용되고 변론주의가 배제 내지 제한되어 심판 청구 당시에는 그 권리관계가 확정되지 않은 상태이고 당사자들도 자신이 보유하게 될 권리 의무의 존재와 범위를 구체적으로 알기 어려움 반면 가사소송규칙 제 조 제 항에 따라 법원은 청구취지를 초과하는 재산분할 정산금 등의 지급을 명할 수 없으므로 재산분할 청구인은 정당한 자신의 몫보다 적은 재산분할 정산금 즉 청구취지 금액을 한도로 하는 정산금 을 지급받게 될 가능성이 있으며 그럼에도 불구하고 외관상 청구인의 청구를 전부 인용하는 재판이 이루어졌으므로 그에 불복할 이익이 있는지 여부가 불분명한 상황에 놓이게 되는데 이러한 점을 고려하면 재산분할로서 청구인에게 이전되어야 하는 재산 내지 금원이 청구취지를 초과할 경우 별소를 통한 잔부 청구가 허용되어야 할 필요성이 크고 재산분할 심판의 효력에 반하는 것도 아님 아울러 다음과 같은 이유로 기존 재판의 기여도를 다투는 의 주장은 받아들이지 않은 사례 이혼에 따른 재산분할의 재판에 대하여는 가사소송법 제 조 제 항에 따른 즉시항고만이 허용되는데 가사소송법 제 조로 준용되는 비송사건절차법 제 조 제 항에 따라 즉시항고로 불복을 할 수 있는 재판에 대하여는 그 취소 변경이 허용되지 않음 마류 가사비송사건 중 이혼에 따른 양육자 지정이나 부양에 관한 처분에 대하여는 사정변경을 이유로 확정된 재판을 변경할 수 있다는 규정이 있으나 민법 제 조 제 항 제 조 이혼에 따른 재산분할재판에 대하여는 이러한 규정이 없음 재산분할은 일부 부양적 요소가 고려될 수 있으나 주로 청산적 요소가 강하고 재산분할의 재판이 확정된 후에도 그 내용을 변경하여 달라는 청구를 허용하게 되면 동일한 분쟁에 대한 소송이 반복될 수 있는데 이는 재산분할에 관한 협의가 되지 않거나 협의할 수 없는 때에는 법원이 이를 정할 수 있도록 하여 분쟁해결을 도모한 민법 제 조의 제 항의 취지에 반함,No_PDF
가사,['[가사]'],부부의 이혼을 인정하면서 함께 마련한 아파트 및 식당 임대차보증금을 재산분할의 대상으로 삼은 사안,과 은 아파트를 임차하여 동거하면서 식당을 차려 운영하다 혼인신고를 마치고 자녀 을 둠 그러나 이 다른 여성과 단 둘이 있는 모습을 본 이 외도를 의심하였고 서로 폭언과 폭행을 하다가 별거에 이름 은 별거 중 에게 알리지 않은 채 식당을 처분하고 아파트 임대차계약을 해지하여 그 보증금을 모두 수령함 과 은 서로를 상대로 이혼 재산분할 위자료 등을 청구하는 소를 제기함 이에 대하여 다음과 같이 판단한 사례 모두 본소 반소로써 이혼을 청구하고 있으므로 혼인파탄을 인정 은 부정행위 의심을 해소하기 위해 노력하기 보다는 폭력을 행사하였고 도 음주 후 폭언을 하거나 재산을 임의로 처분하여 갈등을 심화시켰으므로 혼인파탄의 책임은 쌍방에게 있고 정도가 대등함 은 자신이 수령한 아파트 및 식당의 임대차보증금을 식당 운영 관련 부채 변제 및 생활비 등으로 모두 소비하였으므로 그 금원이 분할 대상인 재산에 해당하지 않는다고 주장하지만 다음과 같은 이유로 배척 은 별거 후 임대차보증금을 수령하였는데 이를 부부 공동생활을 위한 채무변제 등으로 소비하였다는 주장은 그 자체로 설득력이 없고 이를 뒷받침할 객관적인 자료도 없음 금전의 성격상 소비나 은닉이 용이하고 기준 시점을 달리 하면 중복합산의 우려가 있으므로 별거 시점을 기준으로 그 금원이 현존하는 것으로 추정하여 재산분할의 대상 및 가액을 정하는 것이 타당함 제반 사정을 고려하여 재산분할 비율은 으로 결정함 의 친권자는 으로 정하고 의 연령 양육 상황 의 나이 및 직업 소득 가족관계 서울가정법원이 제정 공표한 양육비 산정기준표 등을 종합하여 이 지급할 양육비를 이 초등학교에 입학하기 전까지는 월 만원 그때부터 중학교 입학하기 전까지는 월 만원 그때부터 고등학교 입학하기 전까지는 월 만원 그때부터 성년이 되기 전날까지는 월 만원으로 결정함,No_PDF
가사,['[가사]'],유부녀와 부정행위를 한 남성에게 위자료 지급의무를 인정한 사례,과 은 혼인한 지 년이 넘은 법률상 부부 은 초등학교 동창 을 만나 수년 간 편지를 주고받고 새벽에 통화를 하고 박 일 여행을 가기도 함 은 의 휴대전화를 보고 구체적으로 과 의 관계를 알게 되었고 결국 과 협의이혼에 이름 은 을 상대로 위자료를 청구하는 소를 제기하였는데 이에 대하여 다음과 같이 판단한 사안 민법 제 조 제 호에서 재판상 이혼사유로 규정한 배우자의 부정한 행위 는 간통을 포함하는 보다 넓은 개념으로서 부부의 정조의무에 충실하지 않는 일체의 부정한 행위가 포함됨 은 이 유부녀임을 알면서도 부정행위를 하였고 이는 의 혼인관계를 파탄에 이르게 한 중요한 원인이라고 판단되므로 위자료 지급의무를 인정 은 의 혼인관계가 오래 전부터 파탄에 이른 상태였으므로 불법행위가 성립하지 않는다고 주장하지만 이를 뒷받침할 만한 증거는 부족함 부정행위에 이르게 된 경위 기간 부정행위의 태양 및 정도 부정행위가 혼인관계에 미친 영향 의 혼인기간 및 가족관계 등 제반 사정을 고려하여 이 지급할 위자료를 만 원으로 결정함,No_PDF
가사,['[가사]'],이혼한 아내의 위자료 청구를 배척한 사례,과 은 약 년 정도 혼인관계를 이어가다가 협의이혼에 이름 은 이 으로부터 퍼스널 트레이닝 을 받게 된 것을 계기로 부정행위를 하였고 이로 인해 의 혼인관계가 파탄되었다고 주장하며 을 상대로 손해배상을 청구하는 소를 제기 다음과 같은 이유로 청구를 배척한 사안 제출된 증거에 따르면 이 의 에 댓글을 남기고 특정 장소에 동행하거나 이 에게 눈 돌렸다 는 점을 인정하는 듯한 메시지를 보낸 사실은 인정됨 그러나 그러한 사실만으로 이 에게 배우자가 있다는 사실을 알면서도 부정행위를 하였다거나 시기상 과 의 혼인관계가 파탄에 이르기 전 구체적인 부정행위가 있었고 이로 인해 그 혼인관계가 파탄되었다고 인정하기 어려움,No_PDF
가사,['[가사]'],혼인 취소 및 위자료 청구를 배척하고 이혼 청구만을 받아들인 사례,과 은 동호회에서 만나 동거를 시작 은 과 법률상 혼인관계였는데 에게는 년 전부터 이혼 상태나 마찬가지 라고 설명하였음 은 과 동거 후 과 협의이혼하였고 과 은 혼인신고를 마쳤으나 얼마 되지 않아 서로 다툰 다음 별거에 이름 은 이 자신을 만나기 전 번 결혼하였음에도 번만 결혼했다고 거짓말을 하였고 혼인하면 생활비를 모두 자신이 부담하겠다고 하였으나 지키지 않았으며 직업 역시 속였다는 이유로 주위적으로는 혼인 취소 및 위자료를 예비적으로는 이혼 및 위자료를 청구하는 소를 제기 다음과 같은 이유로 사기로 인해 혼인의 의사표시를 하였다고 인정하지 않은 사안 이 에게 구체적인 전혼의 횟수를 이야기하지 않은 점을 인정하지만 적극적으로 거짓말하였음을 인정할 증거가 없음 아울러 의 첫 번째 혼인은 약 년 전에 이루어졌고 그 기간도 년이 되지 않으며 이미 다른 전혼이 있고 의 나이가 적지 않은 점에 비추어 그와 같은 사정을 알았더라도 혼인하지 않았을 것이라고 단정하기 어려움 이 생활비를 모두 부담하겠다고 말을 하였다거나 직업에 관한 거짓말을 하였다는 사실을 인정할 증거도 부족함 다음과 같은 이유로 의 위자료 지급의무도 성립하지 않는다고 판단한 사안 이 혼인기간 중 생활비를 지급하지 않은 사실은 인정되지만 도 의 경제적 상황이 좋지 않다는 점을 인지한 상태에서 혼인한 것으로 보이고 혼인 기간 또한 약 두 달에 불과하여 그것이 혼인관계 파탄의 주된 원인이라고 보기 어려움 이 다른 여성과 성적인 대화를 나눈 사실도 인정되지만 이는 혼인 전에 있었던 행위인데다가 은 이를 알고도 과 혼인신고를 하였으므로 그것 또한 혼인관계 파탄의 주된 원인이라고 보기 어려움 그 밖에 이 별다른 이유 없이 반복적으로 가출을 하거나 일방적으로 폭언 폭행을 한 사실을 인정할 증거가 부족함 다만 과 이 별거 중이고 도 이혼에 동의하는 점에 비추어 둘의 혼인관계는 회복하기 어려울 정도로 파탄에 이르렀다고 판단되므로 재판상 이혼사유는 인정한 사안,No_PDF
가사,['[가사]'],심과 달리 사실혼 관계를 인정한 사례,망인 은 과 약 년 전 혼인신고를 한 법률상 부부 슬하 자녀 명 망인은 결혼 생활 약 년 만에 집을 나왔고 얼마 되지 않아 을 만나 결혼식을 올리고 동거를 시작 망인은 최근 에게 아파트를 유증한다는 유언공정증서를 작성하고 그로부터 약 년 후 사망 은 법률상 부부인 망인과 이 사실상 이혼상태이므로 비록 중혼적 사실혼임에도 불구하고 법률혼에 준하는 보호를 받아야 한다며 검사를 상대로 망인과의 사실혼 관계 확인을 청구 심은 망인과 이 사실상 이혼상태라거나 혼인관계가 사실상 해소되었다고 인정하기 부족하다고 판단하여 의 청구를 기각하였음 망인은 일정한 직장이 없던 상태에서 사용하던 휴대전화를 집에 두고 아무 말 없이 집을 나갔으므로 로서는 망인에게 연락할 마땅한 방법이 없었음 이후 망인으로부터 협의이혼을 위해 법원에서 만나자고 연락이 온 적이 있었으나 망인은 출석하지 않았고 달리 연락도 없었음 은 자녀에게 망인이 외국에 나가 있다고 말을 하고 선물을 조달하는 등 자녀가 아버지인 망인에 대해 선입견을 갖지 않도록 노력하였고 자녀의 혼사에 방해가 될 것을 우려하여 혼인신고도 유지하기로 하였음 망인의 장례식에 자녀를 보내라는 의 연락을 받고도 자녀를 참석시키지 않았지만 망인과 직접적인 교류가 없던 자녀를 장례식에 참석시키기는 어려웠음 망인은 에게 아파트를 유증하는 유언공정증서를 작성하여 주었음에도 과의 혼인관계를 정리하기 위한 절차는 밟지 않았음 이 항소하였는데 다음과 같은 이유로 과 망인 사이의 사실혼 관계 성립을 인정한 사안 과 망인의 주민등록내역 가족으로서의 공동생활 모습을 종합하면 사실혼관계를 형성하였음이 인정됨 망인과 은 별거 후 망인이 사망할 때까지 어떠한 교류도 하지 않았고 은 법정에 이 망인의 장례식에 아이를 보내달라는 문자를 받고 사망 사실을 인지하였다 본인은 망인의 장례식에 참석할 이유가 없고 남편이라는 의미는 사라진 지 오래이며 아이에게도 생물학적 아버지라는 의미 밖에 없다 는 취지의 진술서를 제출하였으므로 망인과 은 사실상 이혼상태에 있었던 것으로 보임 따라서 과 망인의 사실혼 관계는 법률혼에 준하는 보호를 할 필요가 있고 국민연금법상 사실혼 배우자로서 유족연금 수급권을 인정받기 위한 소로서 그 확인의 이익도 인정됨,No_PDF
가사,['[가사]'],자녀의 성과 본을 재혼한 남편의 것으로 바꿔달라는 심판청구를 기각한 사안,은 과 결혼하여 을 자녀로 두었다가 이혼하였고 은 이 은 이 양육하기로 함 은 이혼 후 와 혼인하여 및 의 자녀들과 함께 살고 있음 은 이 계부 및 동생들과 성이 달라 고통을 받고 있다고 주장하며 의 성과 본을 의 성과 본으로 변경해달라는 심판청구를 함 이에 대하여 다음과 같은 사정을 종합하여 의 성 본을 변경하는 것이 그의 복리에 부합한다고 보기 어렵다고 판단한 사례 과 의 혼인관계는 아직 년이 채 되지 않아 아직 안정적이라고 보기 어려움 은 과 간헐적으로나마 교류하고 있고 성과 본이 변경되면 이들과 성과 본이 달라지며 유대관계가 약화될 가능성이 큼 이 현재 자신의 성과 본에 관하여 별다른 불편함을 호소하고 있지 않음,No_PDF
가사,['[가사]'],친부모가 살아있는 상태에서 조부모가 손자를 입양하는 것을 불허한 사례,과 은 자신들의 자녀 및 이 낳은 손자 과 함께 생활하고 있고 은 현재 을 양육할 의사가 없음 은 의 입양 허가를 구하는 심판청구를 하였으나 다음과 같은 이유로 이를 받아들이지 않은 사례 현재 상황에서 의 입양을 서두를 필요는 없는 반면 입양이 이루어지면 장래 에게 감당하기 어려운 혼란을 초래할 수 있음 현재와 달리 은 향후 으로 하여금 을 양육하게 할 의사가 있고 그럴 필요성도 있어 보임,No_PDF
가사,['[가사]'],이혼 및 위자료 청구 등을 받아들이고 자녀의 성본변경 청구를 기각한 사례,대였던 과 은 약 년 전 교제하다 을 출산하였고 은 자신의 성과 본에 따라 의 출생신고를 마침 과 은 만남과 이별을 거듭하다가 이 을 상대로 인지 등 청구의 소를 제기하게 되었고 그 절차에서 이 을 인지하고 장래양육비를 지급하는 등의 내용으로 조정이 성립됨 이후 과 은 다시 만나다가 혼인신고를 하고 의 성과 본을 아버지 의 것으로 변경하였으나 이 다른 여성 과 만나기 시작했고 외박이 잦아짐 은 이혼을 요구하며 잠자리를 따로 하였고 결국 이 과 의 관계를 암시하는 물건을 발견하고 별거에 이름 은 을 상대로 이혼 재산분할 위자료 및 의 성 본을 의 것으로 변경하여 달라는 청구를 을 상대로는 위자료 청구를 하였음 이에 대하여 다음과 같이 판단한 사례 과 의 혼인관계가 과 의 부정행위로 인하여 파탄에 이르렀으므로 재판상 이혼사유 및 의 위자료 지급의무를 인정하고 제반 사정을 고려하여 위자료 액수를 만 원 만 원으로 결정함 의 양육자는 으로 정하되 다음과 같은 사정을 고려하여 의 성 본을 의 것으로 변경하여 달라는 청구는 받아들이지 않음 의 성 본을 아버지의 것으로 변경한 지 얼마 되지 않았고 이 자신의 성 본이 가지는 의미 자신의 출생 관계 가족 관계 속에서 형성되는 자신의 정체성에 대한 진지한 인식과 고민을 하기에는 아직 어린 나이임 우리 민법은 원칙적으로 아버지의 성 본을 따르도록 규정하고 민법 제 조 제 항 본문 실제로도 그런 경우가 일반적이므로 양육자인 어머니와 의 성 본이 다르더라도 학교나 사회에서 생활하는 데 어려움을 겪을 것을 보이지 않음 현 시점에서 의 성 본을 변경하는 것은 신중할 필요가 있고 성급하게 이를 변경하는 것이 의 복리를 위해 바람직하다고 보기 어려움,No_PDF
가사,['[가사]'],상속인들의 합의를 이유로 상속재산분할 청구의 소를 각하한 사례,은 약 년 전 사망하였고 상속인으로는 배우자 과 자녀 이 있음 과 은 을 상대로 망인 의 부동산 주식 채권 등에 대한 상속재산분할을 구하는 심판청구를 함 소송 계속 중 상속인들 사이에 소유 토지에 관한 합의가 이루어졌고 청구인 은 망인 의 재산 중 토지만을 분할해달라는 형태로 청구취지를 변경함 피상속인이 유언으로 상속재산의 분할방법을 정하거나 이를 정할 것을 제 자에게 위탁한 경우 외에는 공동상속인들은 협의하여 상속재산을 분할할 수 있고 분할의 협의가 이루어지지 않았을 때 비로소 법원에 그 분할을 청구할 수 있는 것인데 민법 제 조 제 조 제 항 제 항 제 조 등 참조 앞서 본 사실관계에 따르면 상속인들 사이에 이미 분할에 관한 협의가 이루어졌다고 보아야 하므로 법원에 상속재산분할을 청구할 이익이 없다고 판단하여 소를 각하한 사안,No_PDF
가사,['[가사]'],남편의 제 자에 대한 손해배상청구를 받아들인 사안,은 혼인한 지 약 년이 지난 법률상 부부 은 결혼생활 중 온라인 게임을 통해 알게 된 과 자위 영상을 서로 보내고 야동사이트 주소를 공유하고 서로 여러 차례 통화를 하면서 각종 부적절한 내용의 메시지를 보냄 은 협의이혼하였고 은 을 상대로 부정행위로 인한 손해배상을 청구 이에 대하여 다음과 같이 판단한 사례 부정행위란 간통보다 넓은 개념으로서 부부의 정조의무에 충실하지 않는 일체의 부정한 행위를 의미 이 유부녀임을 알면서도 이 과 서로 위와 같은 행위를 한 것은 부정행위에 해당한다고 보기에 충분함 의 혼인기간 부정행위 기간 및 정도 부정행위가 혼인관계에 미친 영향 이 부정행위를 알게 된 이후의 상황 등 제반 사정을 고려하여 위자료 액수를 만 원으로 결정함,No_PDF
가사,['[가사]'],어머니의 실종선고 심판청구를 기각한 사안,은 남편이 사망하자 약 년 전 유학을 간 딸 을 상대로 실종선고 심판청구를 함 다음과 같은 이유로 의 심판청구를 기각한 사례 실종선고는 부재자의 생사불명 상태가 일정 기간 계속되고 살아있을 가능성이 적게 된 때 그 사람을 사망한 것으로 간주하는 제도 은 현재 년이 넘도록 연락이 되지 않는다고 주장하지만 의 유학으로 국내에 거주하지 않거나 통신사 가입이력이 없는 것은 자연스럽고 달리 출국 이후 의 행적에 관한 자료가 없으므로 의 생사가 분명하지 않다고 단정하기 어려움,No_PDF
가사,['[가사]'],이혼한 부부의 양육비 전액 포기 합의가 자녀의 복리에 부당하다는 이유로 일부 양육비 지급의무를 인정한 사안,은 혼인했다가 약 년 전 이혼하였고 둘 사이에는 자녀 이 있음 이혼 당시 의 친권자 및 양육자는 으로 정하고 이 매월 양육비 만 원을 지급하기로 하였지만 은 지급하여야 할 양육비를 정도만 지급 그러던 중 과 은 약 년 전 그때까지도 공동 명의로 보유하던 아파트를 매도하면서 매매대금을 모두 이 갖되 에게 양육비를 청구하지 않겠다는 내용의 합의각서를 작성 은 을 상대로 양육비를 청구하는 소를 제기하였는데 이에 대하여 다음과 같은 이유로 일부 양육비 지급의무를 인정한 사례 재산분할과 양육비는 전혀 별개이므로 부모 중 일방이 재산분할을 청구하지 않겠다는 사정만으로 곧바로 양육비 지급책임을 영구적으로 면한다고 볼 수 없음 이 합의각서를 통해 당장 얻게 된 이득은 아파트 매매대금의 인데 이는 이 지급하지 않은 과거 양육비에도 미치지 못함 여기에 이 장래 양육비까지 포기하게 되고 이 이혼 후 계속 경제적 어려움을 겪고 있었던 점 등을 고려하면 이 로부터 실질적으로 양육비 지급을 기대하기 어려운 상태에서 생계유지를 위해 합의각서 작성이 불이익하다는 점을 알면서도 이를 체결할 수밖에 없었을 것으로 보임 은 현재 실직 상태이고 소득활동을 당장 할 수 있는지 불분명하여 이러한 상태가 계속되면 의 복리가 저해될 우려가 큼 이 현재 과다한 채무를 부담하고 있지만 양육비 지급이 불가능할 정도의 상황이라고 보기는 어려움 양육비는 제반 사정을 고려하여 이 성년에 이르는 전날까지 월 만 원으로 결정함,No_PDF
가사,['[가사]'],부부의 이혼을 인정하면서 아내의 재산분할 비율을 높게 인정한 사안,은 결혼한 지 년이 넘은 부부 결혼생활 동안 이 주도적으로 장사를 하였고 은 주로 이를 도와주는 업무를 수행하였는데 의 잦은 음주 경제적 무능력 등을 이유로 내내 갈등을 겪음 은 수년 전부터 집이 아닌 사업장에서 생활하기 시작했고 도 새로 주거지를 임차하여 혼자 거주하는 등 별거하다가 이 을 상대로 이혼 위자료 및 재산분할을 청구하였고 도 을 상대로 반소를 제기 이에 대하여 다음과 같이 판단한 사례 의 혼인관계는 회복하기 어려울 정도로 파탄되었으므로 이혼사유를 인정 서로에 대한 애정과 관심이 부족한 상태에서 갈등을 해결하기 위한 노력을 다하지 않은 모두에게 혼인관계 파탄의 책임이 있고 그 정도도 대등하므로 쌍방의 위자료 청구는 받아들이지 않음 의 제반 사정과 더불어 공동 보유하고 있는 사업장 부지와 건물의 취득 과정에서 이 주된 역할을 한 것으로 보이는 점을 종합하여 재산분할 비율은 으로 결정,No_PDF
