Category,Origin Category,Clean Title,Detail,PDF File
가사,"['[가사]', '[부산가정법원 2018드단209238]']",상당한 기간 별거한 부부의 이혼청구 사건에서 과거양육비는 인정하고 파탄 전후의 재산상태에 비추어 재산분할청구는 기각한 사안,원고와 피고 사이에 단순 별거에서 나아가 경제적 공동체로서의 관계가 단절되어 혼인관계가 실질적으로 파탄되었다고 볼 수 있는 시점은 피고가 생활비 지급을 중단한 경인 것으로 보이는 점 그 무렵 원고 명의의 은행계좌에는 피고의 크레인 처분대금과 비슷한 액수의 예금이 존재하였는데 원고가 위 돈의 출처 및 사용처에 관하여 침묵하고 있는 점 피고가 크레인 처분 이후 경까지는 원고에게 생활비 또는 양육비 명목으로 일정 금액을 지급하였던 점 크레인 처분대금 중 일부는 대출금 변제에 사용되었고 일부는 피고 주거지의 보증금으로 사용되었다가 이후 반환받아 피고의 생활비 등으로 소비되었던 점 원고는 이 사건 소송에서 부터 까지의 과거양육비를 별도로 청구하고 있는 점 등의 사정에 비추어 보면 경 존재하였던 원고 명의 계좌의 예금을 원고의 적극재산에 포함시키지 않는 대신 크레인 처분대금 또한 피고의 적극재산에 포함시키지 않는 것이 공평의 원칙상 타당해 보이고 원고와 피고가 혼인기간 중 공동으로 형성한 재산이 많지 않고 기준일인 소제기일 현재 보유하고 있는 쌍방의 순재산 액수 또한 그리 크지 않은 점 원고가 사건본인들을 양육하게 되는 점 등을 고려하여 각자 명의로 된 재산은 그 명의대로 각자에게 귀속하는 것으로 확정하고 원고와 피고 사이에 더 정산할 것은 없는 것으로 정하는 것이 타당하다고 보아 과거양육비는 인정하고 재산분할청구는 기각한 사례,가사_238
가사,"['[가사]', '[부산가정법원 2019드단204681]']",망인과 피고 을 사이에 양친자관계가 성립하였다고 보아 망인의 동생인 원고의 친생자관계부존재확인 청구를 각하한 사안,망인이 피고 을의 아버지로서 출생신고를 하게 된 경위 이후 피고 을이 친부와 주로 생활한 사정 등에 비춰보면 위 출생신고시나 피고 을의 친부 사망 전까지는 위 출생신고에 입양의 효력이 발생하였다고 보기 어렵다 그러나 친부 사망 이후 피고 을의 결혼식에 망인 부부가 혼주로 참석한 사실 이후 제작된 족보에 피고 을이 망인의 친자로 기재된 사실 피고 을이 망인 부부의 재산관리 망인의 치료 등을 주도적으로 맡아서 실행한 사실 망인 부부의 각 장례에서 혼주로 장례절차를 주관한 사실 등에 비추어 친부 사망 이후에는 위 출생신고에 입양의 효력이 발생하였다고 판단되고 망인이 사망 직전에 피고들을 상대로 친생자관계부존재 확인의 소를 제기하였으나 그 무렵에는 망인의 상태가 치매에까지는 이르지 않았더라도 경도의 인지장애 상태로서 전반적인 인지기능이 저하되어 있었던 것으로 보이므로 망인이 친생자관계부존재 확인의 소를 제기한 사정만으로 위와 같은 판단을 뒤집기에 부족함 재판상 파양청구권은 일신전속적 권리이므로 망인의 동생인 원고가 망인과 피고 을 사이의 재판상 파양에 갈음한 친생자관계부존재의 확인을 구하는 청구는 소의 이익이 없어 부적법하다고 판단한 사례 단 양친자관계가 성립되지 않은 망인과 피고 갑 사이의 친생자관계부존재확인 청구는 인용,가사_239
가사,"['[가사]', '[부산가정법원 2019드단210853(본소), 2019드단214558(반소)]']",피고와 갈등을 빚던 원고가 일방적으로 집을 나가 장기간 귀가하지 아니한 사안에서 반소에 따라 이혼과 일부 위자료 청구를 인용하되 양육비 청구는 기각한 사례,원고와 피고는 년에 혼인신고를 한 법률상 부부로서 현재 성년인 자녀 명을 두었다 원고와 피고는 혼인생활 중 성격 차이 미용실 운영 등 경제적 문제에 대한 이견 가사와 자녀양육 분담 등 여러 사유로 다툼이 있던 중 피고가 년경 원고와 상의 없이 다시 미용실을 개업하려고 하자 원고가 집을 나갔고 년간 중국에 체류하다 귀국하여 어머니 집에서 지내고 있다 피고는 미용실을 운영하며 홀로 두 자녀를 양육해왔다 한편 원고는 피고에게 자녀들의 양육비로 경부터 경까지 합계 원 상당을 지급하였는데 월 평균 지급액은 만 원 상당에 이른다 원고와 피고의 별거 시기 본소 및 반소 제기 시기 피고가 원고의 부정행위 증거로 제출한 사진의 촬영시기 등을 모두 고려하면 원고와 피고의 혼인관계는 원고가 다른 여성을 만나기 이전부터 이미 파탄 상태에 있었다고 인정되고 혼인관계 파탄의 주된 책임은 피고와 갈등을 빚던 중 이혼이나 별거에 대한 명확한 합의 없이 나이 어린 자녀들을 피고에게 맡겨둔 채 일방적으로 집을 나가 장기간 귀가하지 아니한 원고에게 있다고 보아 반소에 따라 이혼과 일부 위자료 청구를 인용하되 양육비 청구는 기각한 사례,가사_240
가사,"['[가사]', '[부산가정법원 2019드단203268]']",원고에게 유책사유가 있다고 보아 이혼 청구를 기각한 사안,이 사건의 사실관계에 비추어 원고와 피고의 혼인관계가 회복할 수 없을 정도로 파탄에 이르렀다고 단정하기 어렵고 설령 부부의 혼인관계가 파탄상태에 있다고 하더라도 원고가 제출한 증거만으로는 원고의 주장처럼 피고가 혼인생활 중 부부의 신뢰를 저버릴 행동을 하고 자녀들과 합세해 원고의 생명에 위협을 느낄 정도의 폭언과 위협적 행동을 하였다는 등 혼인관계 파탄의 전적인 귀책사유가 피고에게 있다는 사실을 인정하기에 부족하고 오히려 원고는 피고와 자녀들에게 가장으로 대우받기만 바랄뿐 피고를 동등한 배우자로 존중하거나 대우하지 아니하였고 자녀들에게도 강압적이고 일방적인 소통을 앞세우는 등 그 동안 가정대소사를 일방적으로 결정하고 통보하는 식으로 하여왔고 피고와 자녀들은 현재 그와 같이 피고가 벌여놓은 일을 수습하는데 역부족인 상황이다 이런 상황에서 최근 일어난 자녀들과의 갈등에 감정적으로 집을 나와 일방적으로 이혼을 요구하고 나아가 현재 상황을 타개할 책임을 피고에게 미룬 채 상속받은 재산이 모두 특유재산이어서 피고에게 지급할 의사가 없으며 오히려 피고로부터 일부 재산을 받아야 한다는 것은 배우자인 피고에 대한 보호와 배려를 제대로 하였다고 보기도 어려워 원고의 이혼청구를 기각한 사례,가사_241
가사,"['[가사]', '[부산가정법원 2018드합200795(본소), 2018드합202111(반소)]']",짧은 기간 안에 법률혼이 파탄된 사안에서 혼인의 불성립에 준한 경우에는 해당하지는 않는다고 보아 원상회복청구를 받아들이지 않은 사례,원고와 피고의 혼인은 법률혼이 성립한 때로부터 약 개월만에 파탄에 이르게 되었으나 양가 부모를 비롯한 하객들 앞에서 결혼식을 올리고 혼인신고를 한 점 비록 피고의 병역 문제로 주말부부 생활을 하였으나 이 사건 아파트를 신혼집으로 임차하여 함께 생활하였던 점 결혼 직후 사건본인을 잉태하여 출산한 점과 함께 혼인생활의 내용 등을 종합하여 보면 원고가 제출한 증거들만으로는 원고와 피고의 혼인관계가 부부공동체로서 의미 있는 혼인생활을 하였다고 인정할 수 없을 만큼 단기간에 파탄되거나 당초부터 혼인을 계속할 의사가 없어 그로 인하여 혼인의 파국을 초래하였다고 인정되는 등 신의칙 내지 형평의 원칙에 비추어 혼인 불성립에 준하여 처리함이 타당한 경우라고 인정하기 부족하고 달리 이를 인정할 증거가 없어 원상회복 청구 주위적 청구 및 재산상 손해배상 청구를 받아들이지 않은 사례 예비적 청구인 이혼 및 재산분할청구는 인용,가사_242
가사,"['[가사]', '[부산가정법원 2018드합200443]']",원고의 이혼 청구 및 위자료 청구 일부를 인용한 사안,원고와 피고는 혼인생활 중 발생하는 의견대립과 상대방 부모에 대한 적절하지 못한 표현 등으로 인하여 잦은 다툼이 있었고 그 과정에서 서로에 대해 폭언을 하기도 하였고 피고는 원고를 폭행하여 상해를 입히기도 하였다 이와 같이 원고와 피고는 혼인생활 중 발생할 수 있는 여러 문제들에 대해 서로의 입장을 배려하면서 현명하게 해결하지 못하고 오히려 갈등이 증폭되어 지금의 상황에 이른 것으로 보인다 특히 피고가 원고에 대하여 폭언과 폭력을 행사한 것이 두 사람 사이의 신뢰관계를 훼손시킨 주된 원인이라 할 것이어서 혼인관계 파탄의 주된 책임은 피고에게 있는 것으로 판단하여 원고의 이혼 청구 및 위자료 청구 일부를 인용한 사례,가사_243
가사,"['[가사]', '[부산가정법원 2019르20720(본소), 2020르20641(반소)]']",추완항소의 항소 이익과 항소심에서의 반소의 적법성을 인정하여 제 심과 달리 쌍방유책에 의한 이혼을 인정한 사안,원고는 피고가 주장하는 반소 청구원인에 대하여 원심에서 전혀 심리가 이루어지지 않아서 피고의 반소를 허용하는 경우 원고의 심급의 이익을 해하게 될 우려가 크므로 피고의 반소가 부적법하다고 주장하나 이 사건 반소 청구의 기초를 이루는 실질적인 쟁점은 혼인파탄의 귀책사유가 누구에게 있는지에 관한 것인바 원고가 이혼을 구하는 이 사건 본소 청구를 하여 제 심에서 혼인파탄의 귀책사유에 관하여 판단함으로써 실질적 쟁점에 대하여 충분히 심리되었으므로 항소심에서의 이 사건 반소 청구는 원고에게 제 심에서의 심급의 이익을 잃게 할 염려가 없다고 봄이 타당하다 또한 원고는 피고가 항소로 주장하는 것이 판결 이유에 대한 불만일 뿐이므로 이 사건 추완항소는 항소의 이익이 없다고 주장하나 피고가 당심에서 이 사건 반소를 제기하면서 유책배우자인 원고의 본소 이혼 청구는 기각되어야 하고 피고의 반소 이혼 청구가 인용되어야 한다고 주장하는바 피고의 이 사건 추완항소는 항소의 이익이 인정되는 경우에 해당한다 나아가 이 사건 혼인관계의 파탄원인에 대해 살펴보면 피고가 결혼식을 올리기 직전에 다른 여성과 교제하고 지속적으로 연락한 사실 및 이후 원고도 내연남과 부정행위를 한 것이 밝혀진 사실에 비추어 쌍방의 잘못이 모두 그 원인으로 작용한 것이고 그 책임의 정도도 대등하다고 판단되므로 본소 및 반소에 의해 이혼한다고 제 심 판결을 변경한 사례,가사_244
가사,"['[가사]', '[부산가정법원 2019르21617(본소), 2019르21624(반소)]']",여러 사정에 비추어 원고의 신용회복채무는 부부공동생활로 인한 채무로 볼 수 없어 재산분할대상에서 제외한 사안,원고는 자신이 부담하고 있는 억 천여만 원의 신용회복채무가 부부공동생활에 기하여 발생한 채무이므로 재산분할대상에 포함되어야 한다는 취지로 주장하나 원고가 피고와 상의 없이 주식투자를 위해 이 사건 아파트를 담보로 천만 원을 대출받았고 이후 위 대출금을 상환하기 위해 다시 제 금융권으로부터 고금리의 추가 신용대출을 받게 되었는데 위 채무발생 경위와 대출금 사용처 등에 비추어 위 채무는 원고의 개인채무에 불과하고 위와 같이 총 개의 금융기관에 대하여 합계 약 억 만 원의 채무를 부담하게 되면서 결국 신용회복절차를 밟게 되었는바 원고는 위 각 채무에 관하여 단순히 이 사건 아파트 담보대출금을 갚기 위해 고금리의 추가대출을 받았고 빚을 빚으로 갚는 악순환이 반복되어 채무가 늘어났다 는 취지로만 주장하고 있는데 대출횟수와 대출금액에 비추어 원고의 주장을 그대로 받아들이기 어렵고 그밖에 원고가 제출한 증거만으로는 위 각 채무를 부담하게 된 경위와 채무의 사용내역이 불분명하므로 이를 일상가사에 관한 채무이거나 부부공동생활에 기한 채무로 볼 수 없어 재산분할대상에서 제외한 사례,가사_245
가사,"['[가사]', '[부산가정법원 2019느단200539(본심판), 2019느단201512(반심판)]']",협의이혼 당시 공동친권으로 협의하였으나 사정변경에 의해 청구인 단독친권으로 변경하고 양육비를 증액한 사안,청구인과 상대방은 년 협의이혼하면서 청구인이 사건본인들을 양육하되 사건본인들에 대한 친권은 공동으로 행사하고 상대방이 청구인에게 사건본인들의 양육비로 인당 월 만 원을 지급하기로 협의하였으나 청구인과 사건본인들은 현재 시에 거주하고 있고 상대방은 부산에 거주하고 있어 친권의 공동 행사가 물리적으로 원활하게 이루어지기 어려운 점 경 사건본인 무가 보험사고를 당하였고 청구인은 상대방에게 보험금 수령을 위하여 공동친권자로서의 협조를 요청하였으나 상대방이 이에 응하지 않아 아직까지 보험금을 수령하지 못하고 있는 등 상대방이 공동친권자로 지정되면 오히려 사건본인들의 복리에 반하는 경우가 발생할 가능성이 높은 점 등에 비추어 보면 사건본인들의 친권자를 청구인과 상대방에서 청구인으로 변경함이 상당하고 사건본인들의 나이와 양육상황 청구인과 상대방의 소득 내지 재산상황 서울가정법원의 양육비 산정기준표 등을 두루 참작하면 협의이혼 당시 정한 사건본인들의 양육비 액수는 이를 변경할 특별한 사정변경이 있거나 그렇지 않더라도 부당하다고 판단되므로 이를 증액함이 상당하다고 판단한 사례,가사_246
가사,"['[가사]', '[부산가정법원 2019재드단29]']",피고가 제기한 재심의 소가 제소기간 경과 후 제기된 것으로서 부적법하여 각하한 사안,원고가 피고를 상대로 이혼 청구의 소를 제기하였고 이 법원이 피고에 대한 송달을 공시송달로 진행한 끝에 재심대상판결을 선고하여 위 판결이 확정되었다 피고는 본인 증명서류를 발급받기 위해 주민센터를 방문한 경 재심대상판결이 선고된 사실을 알았다며 소송대리인을 선임한 후 추완항소장을 제출하였으나 항소취하서를 제출하였다 이후 원고가 피고의 소재를 확인할 수 있었음에도 이를 확인하지 않은 채 공시송달의 방법으로 재심대상판결을 편취하였다고 주장하며 이 사건 재심의 소를 제기하였다 재심의 소는 당사자가 판결이 확정된 뒤 재심의 사유를 안 날부터 일 이내에 제기하여야 하는바 위와 같은 사실에 비추어 피고는 경 재심대상사건이 공시송달로 진행되어 재심대상판결이 이미 확정된 사실을 알았음에도 그로부터 일이 지난 이후인 에야 이 사건 재심의 소를 제기하여 이 사건 재심의 소는 제심제기의 기간 경과 후에 제기된 것으로 부적법하다고 보아 각하한 사례,가사_247
가사,"['[가사]', '[부산가정법원 2020드단202001]']",가출한 외국인 배우자를 상대로 주위적으로 혼인무효를 제 예비적으로 혼인취소를 제 예비적으로 이혼을 구하였는데 이혼청구만 인용한 사안,원고는 국제결혼중개업소의 소개로 피고를 만나 년 월 베트남에서 결혼식을 올린 후 년 월 이 사건 혼인을 하였다 피고는 년 월 국내에 입국하였는데 혼인기간 중 부부관계를 거부하고 함께 식사도 하지 않았으며 한국생활에 적응하려는 노력도 보이지 않다가 년 월 베트남으로 출국하였다가 년 월 다시 입국하였으나 공항에서 옷을 갈아입고 사라져 현재까지 아무런 연락이 없다 위와 같은 사안에서 원고는 이 사건 혼인은 혼인의사 없이 혼인을 가장하여 취업을 할 목적으로 혼인신고를 한 것이므로 당사자 사이에 혼인의 합의가 없는 때에 해당하여 무효이거나 주위적 청구 피고가 국내에 취업할 생각으로 원고를 속여 이 사건 혼인에 이른 것이므로 민법 조 제 호에 따라 혼인의 취소를 구한다 제 예비적 청구 고 주장하나 원고가 제출한 증거만으로는 이를 인정하기에 부족하고 달리 이를 인정할 증거가 없으므로 위 각 주장은 받아들일 수 없고 다만 위와 같은 사정은 민법 제 조 제 호의 이혼사유에 해당하므로 이혼청구 제 예비적 청구 를 인용한 사례,가사_248
가사,"['[가사]', '[부산가정법원 2019드단208171]']",원고의 유책정도가 피고보다 크지 않다고 보아 이혼 청구를 인용한 사안,장남으로 가족 중심적인 원고는 자유분방하고 개인적인 성향인 피고가 시댁과의 관계로 힘들어하며 하소연을 늘어놓자 그 사이에서 힘들어했고 그밖에 피고의 흡연 음주와 음주 후 문제행동 수입에 비해 과도한 지출 양육을 이유로 부부관계를 거부하는 일 등으로 피고에 대한 불만이 컸던 터에 암 말기로 병원에 입원한 원고의 아버지에 대해 시댁과의 관계로 힘들었던 피고가 몇 차례 병문안 외에 병문안을 거절하며 연락을 받지 않고 원고의 아버지의 장례식장에 절만 하고 가겠다고 연락하여 원고가 그럴 거면 오지 말라고 하였는데 결국 장례식에 참여하지 않자 원고가 이혼을 결심하고 이 사건 소를 제기한 사안에서 원고의 유책정도가 피고보다 크지 않다고 보아 이혼 청구를 인용한 사례,가사_249
가사,"['[가사]', '[부산가정법원 2020브15]']",자의 성과 본의 변경허가 청구를 기각한 사안,사건본인의 친부인 윤 이 성 본 변경에 동의하고 있는 사실 청구인이 정 의 친자를 임신한 사실이 인정되나 청구인과 정 은 혼인기간이 아직 개월이 되지 않을 정도로 짧고 사건본인은 이제 막 초등학교에 입학하였으므로 아직 학교생활이나 교우관계에서 구체적인 불이익이 발생하였다고 보기 어려운 점 사건본인이 성과 본의 변경을 희망한다고 하여도 사건본인의 나이에 비추어 자신의 성과 본의 변경이 갖는 의미 및 이에 대한 영향을 정확히 이해하고 그 의사를 표현하였다고 보기 어려운 점 등을 고려하면 재혼가정이 현재보다 더 안정되고 사건본인이 정 과 가족으로서의 유대감 형성을 위한 시간을 더 가진 후에야 사건본인의 성과 본의 변경을 고려하여야 할 것으로 보이고 청구인이 주장하는 사정만으로 사건본인의 복리를 위하여 그의 성과 본을 변경할 필요가 있다는 점이 충분히 소명되었다고 볼 수 없다고 판단한 사례,가사_250
가사,"['[가사]', '[부산가정법원 2019드합201597(본소), 2019드합201603(반소)]']",원고의 본소 이혼 및 위자료 청구 일부를 인용하고 피고의 반소 이혼 청구 및 위자료 청구를 기각한 사안,원고와 피고가 최초 혼인신고를 한 이후부터 서로에 대한 성격차이로 자주 다투게 되었고 한차례 이혼과 재결합을 거치면서도 관계가 개선되지 못한 점은 인정되나 피고가 가정이 있는 공동피고와 부정행위를 일삼고 공동피고가 분양받은 집에 전입신고까지 마친 사실에 비추어 원고와 피고의 혼인관계는 피고의 부정행위로 인하여 파탄되었으므로 그 주된 책임은 피고에게 있다고 판단하여 원고의 본소 이혼 및 위자료 청구 일부를 인용하고 피고의 반소 이혼 청구 및 위자료 청구를 기각한 사례,가사_251
가사,"['[가사]', '[부산가정법원 2018르21412(본소), 21429(반소)]']",원고의 본소 이혼 및 일부 위자료 청구를 인용하고 피고의 반소 이혼 및 위자료 청구를 기각한 사안,원고와 피고는 년 혼인신고를 한 부부로서 피고는 년경부터 원고가 이 사건 이혼 등 청구의 소를 제기한 년경까지 다른 여성들과 만남을 가져왔고 혼인기간 동안 원고를 여러 차례 폭행하고 폭언을 하였는데 년 월에는 피고가 가입한 다단계 문제로 원고와 다투다가 원고의 옆구리를 발로 차 딸의 신고로 경찰이 출동하기도 하였다 이러한 사실에 의하면 원고와 피고의 혼인관계는 피고의 폭행과 폭언 다른 여성과의 부적절한 만남으로 인한 부부 사이의 신뢰 파괴 등 피고의 주된 잘못으로 인하여 파탄되었다고 인정되므로 원고의 본소 이혼 및 일부 위자료 청구를 인용하고 피고의 반소 이혼 및 위자료 청구를 기각한 사례,가사_252
가사,"['[가사]', '[부산가정법원2019드단214992]']",피고의 부당한 대우로 인한 이혼과 위자료 청구를 인용한 사안,원고와 피고는 년 혼인신고를 마친 법률상 부부로 피고는 혼인기간 중 가사와 자녀양육 책임을 원고에게만 미룬 채 가정에 소홀하였고 원고를 무시하고 폭언과 폭행을 일삼았으며 피고의 폭행으로 청력이 소실된 원고가 잘 듣지 못한다는 이유로 다시 폭력을 행사하기도 하였다 만성신부전증을 앓던 원고가 경 자녀로부터 신장이식수술을 받자 피고는 원고의 친정식구들이 병원비를 지원해 주지 않는다며 폭언을 하였고 수술 이후에 무리한 활동이 힘든 원고에게 돈을 벌어오지 않는다며 타박하였다 원고는 부당한 대우를 견디기 힘들어 집을 나갔고 피고는 원고에게 집에 들어오면 죽여버리겠다 는 등 위협적인 문자를 보냈다 위 인정사실에 의하면 피고의 위와 같은 행위는 민법 제 조 제 호에 따른 재판상 이혼 사유에 해당하고 이로 인해 원고와 피고의 혼인관계가 파탄에 이르게 됨으로써 원고가 상당한 정신적 고통을 받았을 것임은 경험칙상 명백하므로 원고의 이혼 및 위자료 청구는 이유 있다고 판단한 사례,가사_253
가사,"['[가사]', '[부산가정법원 2019르20829]']",원고와 피고 사이에는 유효한 양친자관계가 성립하여 친생자관계부존재확인청구가 부적법하다고 판단한 사안,친생자출생신고 자체가 입양의 의사를 추단하게 하는 정황이라고 볼 수 있는데 대법원 선고 므 판결 등 참조 원고는 피고가 자신의 친생자가 아님을 알면서도 피고를 데려온 지 약 개월 만에 직접 피고에 대한 출생신고를 했던 점 원고는 피고에 대한 출생신고를 한 뒤부터 이 사건 소를 제기할 때까지 약 년이 넘는 기간 동안 이에 대하여 아무런 이의를 제기하지 않았던 점 원고는 망 병이 피고를 데려왔을 때부터 고등학교를 졸업할 때까지 피고와 한 집에서 같이 생활하였고 피고의 결혼식 망 병의 장례식 등 집안의 대소사를 함께 처리하였던 점 등에 비추어 보면 원고의 피고에 대한 입양의사를 추단할 수 있고 원고와 피고 사이에 양친자로서의 신분적 생활사실도 구비되었다고 판단되므로 원고와 피고 사이에는 유효한 양친자관계가 성립하고 원 피고 사이에 파양에 의하여 양친자관계를 해소할 필요가 있다는 등의 특별한 사유도 보이지 아니한다는 이유로 이 사건 친생자관계부존재확인청구가 부적법하다고 판단한 사례,가사_254
가사,"['[가사]', '[부산가정법원 2020느단574]']",성과 본의 변경허가 청구를 기각한 사안,청구인에게는 현재 성과 본을 같이하는 형제자매가 있는바 청구인만 성과 본을 변경할 경우 청구인뿐 아니라 형제자매 모두에게 사회생활과 공법관계에서 중대한 혼란과 번거로움을 초래하게 되므로 청구인의 성과 본을 변경하는 것은 적절하지 않다고 보아 성과 본의 변경허가 청구를 기각한 사례,가사_255
